{
  "command": "show-gaps",
  "repo_root": "/root/sikk-gmgn",
  "safe_mode": false,
  "inputs": {
    "command": "show-gaps",
    "repo_root": "/root/sikk-gmgn",
    "safe_mode": false,
    "registry": null,
    "config": null,
    "sample": null,
    "document": null,
    "goal": null,
    "run_id": "o00_run_20260514_004255_804676",
    "from_stage": null
  }
}