{
  "command": "recover",
  "repo_root": "/root/sikk-gmgn",
  "safe_mode": true,
  "inputs": {
    "command": "recover",
    "repo_root": "/root/sikk-gmgn",
    "safe_mode": true,
    "registry": null,
    "config": null,
    "sample": null,
    "document": null,
    "goal": null,
    "run_id": "o00_run_20260514_005234_735991",
    "from_stage": null
  }
}